[
  {
    "name": "opensource-sanitizer",
    "model": "gemini-2.5-pro",
    "tools": [
      "Read",
      "Grep",
      "Glob",
      "Bash"
    ],
    "path": "agents/opensource-sanitizer.md",
    "status": "VALID"
  },
  {
    "name": "researcher-test",
    "model": "gemini-2.5-flash",
    "tools": [
      "run_shell_command"
    ],
    "path": "agents/researcher-test.md",
    "status": "VALID"
  },
  {
    "name": "code-architect",
    "model": "gemini-2.5-pro",
    "tools": [
      "Read",
      "Grep",
      "Glob",
      "Bash"
    ],
    "path": "agents/code-architect.md",
    "status": "VALID"
  },
  {
    "name": "conversation-analyzer",
    "model": "gemini-2.5-pro",
    "tools": [
      "Read",
      "Grep"
    ],
    "path": "agents/conversation-analyzer.md",
    "status": "VALID"
  },
  {
    "name": "java-reviewer",
    "model": "gemini-2.5-pro",
    "tools": [
      "Read",
      "Grep",
      "Glob",
      "Bash"
    ],
    "path": "agents/java-reviewer.md",
    "status": "VALID"
  },
  {
    "name": "refactor-cleaner",
    "model": "gemini-2.5-pro",
    "tools": [
      "Read",
      "Write",
      "Edit",
      "Bash",
      "Grep",
      "Glob"
    ],
    "path": "agents/refactor-cleaner.md",
    "status": "VALID"
  },
  {
    "name": "rust-build-resolver",
    "model": "gemini-2.5-pro",
    "tools": [
      "Read",
      "Write",
      "Edit",
      "Bash",
      "Grep",
      "Glob"
    ],
    "path": "agents/rust-build-resolver.md",
    "status": "VALID"
  },
  {
    "name": "gan-generator",
    "model": "gemini-2.5-pro",
    "tools": [
      "Read",
      "Write",
      "Edit",
      "Bash",
      "Grep",
      "Glob"
    ],
    "path": "agents/gan-generator.md",
    "status": "VALID"
  },
  {
    "name": "cpp-reviewer",
    "model": "gemini-2.5-pro",
    "tools": [
      "Read",
      "Grep",
      "Glob",
      "Bash"
    ],
    "path": "agents/cpp-reviewer.md",
    "status": "VALID"
  },
  {
    "name": "csharp-reviewer",
    "model": "gemini-2.5-pro",
    "tools": [
      "Read",
      "Grep",
      "Glob",
      "Bash"
    ],
    "path": "agents/csharp-reviewer.md",
    "status": "VALID"
  },
  {
    "name": "code-explorer",
    "model": "gemini-2.5-pro",
    "tools": [
      "Read",
      "Grep",
      "Glob",
      "Bash"
    ],
    "path": "agents/code-explorer.md",
    "status": "VALID"
  },
  {
    "name": "code-reviewer",
    "model": "gemini-2.5-pro",
    "tools": [
      "Read",
      "Grep",
      "Glob",
      "Bash"
    ],
    "path": "agents/code-reviewer.md",
    "status": "VALID"
  },
  {
    "name": "go-reviewer",
    "model": "gemini-2.5-pro",
    "tools": [
      "Read",
      "Grep",
      "Glob",
      "Bash"
    ],
    "path": "agents/go-reviewer.md",
    "status": "VALID"
  },
  {
    "name": "docs-lookup",
    "model": "gemini-2.5-pro",
    "tools": [
      "Read",
      "Grep",
      "mcp__context7__resolve-library-id",
      "mcp__context7__query-docs"
    ],
    "path": "agents/docs-lookup.md",
    "status": "VALID"
  },
  {
    "name": "seo-specialist",
    "model": "gemini-2.5-pro",
    "tools": [
      "Read",
      "Grep",
      "Glob",
      "Bash",
      "WebSearch",
      "WebFetch"
    ],
    "path": "agents/seo-specialist.md",
    "status": "VALID"
  },
  {
    "name": "opensource-packager",
    "model": "gemini-2.5-pro",
    "tools": [
      "Read",
      "Write",
      "Edit",
      "Bash",
      "Grep",
      "Glob"
    ],
    "path": "agents/opensource-packager.md",
    "status": "VALID"
  },
  {
    "name": "kotlin-build-resolver",
    "model": "gemini-2.5-pro",
    "tools": [
      "Read",
      "Write",
      "Edit",
      "Bash",
      "Grep",
      "Glob"
    ],
    "path": "agents/kotlin-build-resolver.md",
    "status": "VALID"
  },
  {
    "name": "healthcare-reviewer",
    "model": "gemini-2.5-pro",
    "tools": [
      "Read",
      "Grep",
      "Glob"
    ],
    "path": "agents/healthcare-reviewer.md",
    "status": "VALID"
  },
  {
    "name": "type-design-analyzer",
    "model": "gemini-2.5-pro",
    "tools": [
      "Read",
      "Grep",
      "Glob",
      "Bash"
    ],
    "path": "agents/type-design-analyzer.md",
    "status": "VALID"
  },
  {
    "name": "architect",
    "model": "gemini-2.5-pro",
    "tools": [
      "Read",
      "Grep",
      "Glob"
    ],
    "path": "agents/architect.md",
    "status": "VALID"
  },
  {
    "name": "gan-evaluator",
    "model": "gemini-2.5-pro",
    "tools": [
      "Read",
      "Write",
      "Bash",
      "Grep",
      "Glob"
    ],
    "path": "agents/gan-evaluator.md",
    "status": "VALID"
  },
  {
    "name": "comment-analyzer",
    "model": "gemini-2.5-pro",
    "tools": [
      "Read",
      "Grep",
      "Glob",
      "Bash"
    ],
    "path": "agents/comment-analyzer.md",
    "status": "VALID"
  },
  {
    "name": "rust-reviewer",
    "model": "gemini-2.5-pro",
    "tools": [
      "Read",
      "Grep",
      "Glob",
      "Bash"
    ],
    "path": "agents/rust-reviewer.md",
    "status": "VALID"
  },
  {
    "name": "reproduce-me",
    "model": "gemini-2.5-flash",
    "tools": [
      "run_shell_command"
    ],
    "path": "agents/reproduce-me.md",
    "status": "VALID"
  },
  {
    "name": "kotlin-reviewer",
    "model": "gemini-2.5-pro",
    "tools": [
      "Read",
      "Grep",
      "Glob",
      "Bash"
    ],
    "path": "agents/kotlin-reviewer.md",
    "status": "VALID"
  },
  {
    "name": "code-simplifier",
    "model": "gemini-2.5-pro",
    "tools": [
      "Read",
      "Write",
      "Edit",
      "Bash",
      "Grep",
      "Glob"
    ],
    "path": "agents/code-simplifier.md",
    "status": "VALID"
  },
  {
    "name": "pr-test-analyzer",
    "model": "gemini-2.5-pro",
    "tools": [
      "Read",
      "Grep",
      "Glob",
      "Bash"
    ],
    "path": "agents/pr-test-analyzer.md",
    "status": "VALID"
  },
  {
    "name": "e2e-runner",
    "model": "gemini-2.5-pro",
    "tools": [
      "Read",
      "Write",
      "Edit",
      "Bash",
      "Grep",
      "Glob"
    ],
    "path": "agents/e2e-runner.md",
    "status": "VALID"
  },
  {
    "name": "loop-operator",
    "model": "gemini-2.5-pro",
    "tools": [
      "Read",
      "Grep",
      "Glob",
      "Bash",
      "Edit"
    ],
    "path": "agents/loop-operator.md",
    "status": "VALID"
  },
  {
    "name": "database-reviewer",
    "model": "gemini-2.5-pro",
    "tools": [
      "Read",
      "Write",
      "Edit",
      "Bash",
      "Grep",
      "Glob"
    ],
    "path": "agents/database-reviewer.md",
    "status": "VALID"
  },
  {
    "name": "doc-updater",
    "model": "gemini-2.0-flash",
    "tools": [
      "Read",
      "Write",
      "Edit",
      "Bash",
      "Grep",
      "Glob"
    ],
    "path": "agents/doc-updater.md",
    "status": "VALID"
  },
  {
    "name": "dart-build-resolver",
    "model": "gemini-2.5-pro",
    "tools": [
      "Read",
      "Write",
      "Edit",
      "Bash",
      "Grep",
      "Glob"
    ],
    "path": "agents/dart-build-resolver.md",
    "status": "VALID"
  },
  {
    "name": "silent-failure-hunter",
    "model": "gemini-2.5-pro",
    "tools": [
      "Read",
      "Grep",
      "Glob",
      "Bash"
    ],
    "path": "agents/silent-failure-hunter.md",
    "status": "VALID"
  },
  {
    "name": "a11y-architect",
    "model": "gemini-2.5-pro",
    "tools": [
      "Read",
      "Write",
      "Edit",
      "Bash",
      "Grep",
      "Glob"
    ],
    "path": "agents/a11y-architect.md",
    "status": "VALID"
  },
  {
    "name": "planner",
    "model": "gemini-2.5-pro",
    "tools": [
      "Read",
      "Grep",
      "Glob"
    ],
    "path": "agents/planner.md",
    "status": "VALID"
  },
  {
    "name": "performance-optimizer",
    "model": "gemini-2.5-pro",
    "tools": [
      "Read",
      "Write",
      "Edit",
      "Bash",
      "Grep",
      "Glob"
    ],
    "path": "agents/performance-optimizer.md",
    "status": "VALID"
  },
  {
    "name": "harness-optimizer",
    "model": "gemini-2.5-pro",
    "tools": [
      "Read",
      "Grep",
      "Glob",
      "Bash",
      "Edit"
    ],
    "path": "agents/harness-optimizer.md",
    "status": "VALID"
  },
  {
    "name": "tdd-guide",
    "model": "gemini-2.5-pro",
    "tools": [
      "Read",
      "Write",
      "Edit",
      "Bash",
      "Grep"
    ],
    "path": "agents/tdd-guide.md",
    "status": "VALID"
  },
  {
    "name": "python-reviewer",
    "model": "gemini-2.5-pro",
    "tools": [
      "Read",
      "Grep",
      "Glob",
      "Bash"
    ],
    "path": "agents/python-reviewer.md",
    "status": "VALID"
  },
  {
    "name": "opensource-forker",
    "model": "gemini-2.5-pro",
    "tools": [
      "Read",
      "Write",
      "Edit",
      "Bash",
      "Grep",
      "Glob"
    ],
    "path": "agents/opensource-forker.md",
    "status": "VALID"
  },
  {
    "name": "go-build-resolver",
    "model": "gemini-2.5-pro",
    "tools": [
      "Read",
      "Write",
      "Edit",
      "Bash",
      "Grep",
      "Glob"
    ],
    "path": "agents/go-build-resolver.md",
    "status": "VALID"
  },
  {
    "name": "security-reviewer",
    "model": "gemini-2.5-pro",
    "tools": [
      "Read",
      "Write",
      "Edit",
      "Bash",
      "Grep",
      "Glob"
    ],
    "path": "agents/security-reviewer.md",
    "status": "VALID"
  },
  {
    "name": "cpp-build-resolver",
    "model": "gemini-2.5-pro",
    "tools": [
      "Read",
      "Write",
      "Edit",
      "Bash",
      "Grep",
      "Glob"
    ],
    "path": "agents/cpp-build-resolver.md",
    "status": "VALID"
  },
  {
    "name": "gan-planner",
    "model": "gemini-2.5-pro",
    "tools": [
      "Read",
      "Write",
      "Grep",
      "Glob"
    ],
    "path": "agents/gan-planner.md",
    "status": "VALID"
  },
  {
    "name": "chief-of-staff",
    "model": "gemini-2.5-pro",
    "tools": [
      "Read",
      "Grep",
      "Glob",
      "Bash",
      "Edit",
      "Write"
    ],
    "path": "agents/chief-of-staff.md",